text,label
"I am done with Uber! Have been using them for couple of months in NYC, until very recently most drivers were fine though I was never a fan of the surge pricing (I paid over $40 for less than 2 miles). Early this week I called for a car, supposed to be a 5 minute wait turned into 20 minutes. I texted and called the driver multiple times but no response. Then he cancelled the ride without my consent, and had the nerve to charge me a $10 fee! Why should I pay for no service, especially the driver was the one who cancelled, not me! He was a no-show and I ended up walking few blocks to catch a cab and late for a meeting, after wasted close to half an hour waiting! The worse thing is, there isn't a customer service number to call. I emailed Uber support and they took a while to respond. I was offer a ride credit but I demanded a refund, as I had no intention to use them again. I filed disputes with both PayPal and my credit card, then all of a sudden Uber freezed my account. They have multiple agents contacting me and asked for photo ID and credit card copy...why would I do that? It's fraud waiting to happen, and can't be legal! I have sick of the way to treat their customers and how they conduct business. I am going to file a complaint with the BBB also, I will not use them again.",1
"I have tried on 2 separate occasions to get a ride home from Uber. The first time, the driver cancelled the ride when he saw that I had a cart full of groceries. I was charged for that cancellation, but later given a $5 credit. When I went to use Uber again, the driver was in front of me, pulled up. I waved and he pulled away. I watched him around my apt complex. after that, I was charged $5 I was asked to rate the driver. How can one rate a driver when you did not even get in the car? That driver was given 1 star for not even attempting to contact me and for just driving by a couple of times. I was waiting outside before he got there. Literally, he was only 2 ft in front of me when he pulled up. He saw me and left. The last time I tried to use Uber again for a ride home from the grocery store (I contacted customer service about being left at the store the first time and was told that it would not happen again) Well, it did. The driver never showed and never bothered to contact me. He cancelled the ride once he got there. I requested Uber again, he cancelled the ride immediately. No charge for either cancellation. So, if there is any Uber driver's out who can answer this... since Uber customer support does not answer it directly. Does Uber not pick up customers from grocery stores?",1
"I was picked up from my workplace on 30/8/2017 at around 8:56 pm by cab no. TN 07 CE 8554. The trip started on my account but the drivers account was not updated. navigation kept directing the driver to my pick up point. finally after taking a full circle and wasting my time he called up customer service. the executive directed him to cancel my ongoing trip and ask me to book another assuring that the same cab will be assigned. the driver cancelled and when i booked again i was assigned a ride 20 min away. the driver asked me to get off on the street amidst a downpour. when i refused to get off away from my pick up point, while it was raining and demanded to talk to customer service again, the driver called up the office again but refused to let me speak. customer service executive told him to tell me that i am not being charged for the trip so get off. I have never seen such behavior in my life. the moment you undertake the responsibility of a trip, you are taking responsibility for our time, safety and good service delivery and in return take payment from us. you cannot waste our time, compromise our safety and then put us through discomfort and finally say 'ok we won't charge you this time'. looks like uber is no better than a bunch of scoundrels with no work ethics or standards.",1
"I happened to book an uber ride, driver accepted the ride. Even after 15 mins i din't see car moving around. I tried calling the driver, he didn't respond. I messaged on uber app, mentioning the address and asking him if he is going to pick me up? Driver cancelled after 5 mins or so!!! i was stranded with no where to go!!! this is ridiculous. Again uber charged me cancellation charges when driver cancelled the ride? This driver has 5* rating!!! When i reached uber customer service asking me to compensate as i have wasted 30 mins bcos of driver, uber says "" Its ur problem and drivers, we can't take any responsibility for driver actions!!"" Why customers are charged cancellation charges when we cancel even after 2 mins, here driver cancelled after 15 mins!!! Uber is a ridiculous company which is misusing customer data and leveraging the loop holes!! Uber should be banned in US and every customer whose personal info is leaked should be paid compensation!! Uber tracks every movement and claims its to improve trip experience!! My suggestion is first do a proper driver orientation and back verification, which will definitely improve customer experience!!! Notice that if anyone has lyft and uber, uber price is lower, but if ur using uber alone they hike the price.... they do a predatory pricing!!!",1
"My son booked me an Uber to take me to the station to catch a train to the airport. When I got in the driver started going at about one mile an hour and drove up loads of little side roads, going round in circles in completely the wrong direction and wasting a good 15 minutes. When I told him I had a train and flight to catch he suddenly said he was looking for other customers because it was a shared ride. I rang my son who said it definitely wasn't shared and to tell the driver to get a move on. He refused to. I asked could he then change it to unshared and charge the extra and he said no. I asked him to call his superior and he said there was nobody there to call. I explained that if I missed the one train an hour I'd miss my flight and there wasn't another one for seven days. Effectively I'd lose my whole holiday. He shrugged and carried on at one mile an hour. There was nothing I could do and even if I'd got out of his car he'd taken me down such quiet roads there was no chance of finding another cab. This was 3am in the morning and eventually after much screaming on my part he gave up looking for sharers - but I made it to the station with two minutes to spare and had to to try and run up numerous platform steps with two pieces of heavy luggage. I will never forget the experience and will never ever use them again.",1
"I would give Ron, uber driver from Sante Fe negative stars if I could. On Oct. 12, 2018 we requested a uber driver to take us from our hotel to Sante Fe airport at 5:30am.The driver showed up, and intrduced himself as Ron. He seemed nice enough. My wife and I got in back, and proceeded to the airport. As we're driving, my wife and I are making small talk with him(where you from, how long you been an uber driver, and so on. Said he was from NY, and had been driving for uber in Sante Fe for 4 years. He started talking about tips, which I thought was very inappropriate. He said he buys water and hand sanitizer for his customers. I said ya, looks like a wet bar back here(lol). His demeanor quickly changed. He said "" you people are invading my privacy."" HUH! You ""have no bussuiness invading my privacy RIGHT, RIGHT"" (yelling at us) SCARY! We said we're just making small talk as he continued to yell at us. Finally, I told my wife I need to record this. He heard this, pulled over, and told us to get out. It was 5:45am, 40 degrees in an area that was dark no street light or bussinesses miles from our destination.He opened my wives door, and rudely told her to get out. He threw our luggage into the street and drove away. My wife is 65, and has a sling on her arm after a surgery. We didn't know what to do. It was our first uber ride, and I'm pretty sure our last.",1
"this unprofessional driver wangjiku, I requested uber around 9:25.. if she don't have idea on pick up location she should not accept the request first of all.. but she accepted my request.. I wait for her nearly half an hour.. I'm giving her directions in the phone very clearly.. but she can not able to found me.. she even don't know the famous place DMV office of Santa Clara, I stressed her in the phone our famous apartment leasing office is exactly opposite to the DMV office.. but still waste driver did not catche me.. finally she is telling that she is going to cancel the trip in phone, but not even cancelled my trip.. because if I cancel the trip I'll get 2$ charge.. so I'm waiting for her to cancel the trip. I wait for 15 mins she did not cancel the trip. until she cancel the trip I can not able to request for another driver.. because she accepted that she can not able to pickup me, then the right thing is she must cancel the trip.. but not even its happened in this case.. so she has done these many mistakes1) she don't have idea of area where she is going to pick up 2) though I'm giving her clear directions she did not found me 3) she accepted that she can not able to pick up me after my almost half an hour request.. but still she did not cancel the trip.. 4) because of her unprofessional behavior she charged me cancellation fee.. she wasted my precious time.. my request to the management is don't give permission to the such kind of unprofessional and unexperinced drivers to drive the uber.. because customers finally get bad openion and worest experiences with the UBER",1
"When Uber runs over its customers. Buyer betware - Ueber is not all that is seems. At first I liked it. Ninety percent of the drivers are decent hard working honest people. But it's a crap shoot. I'd estimate ten percent are unscroupulous and should you ride with one of them Uber has no customer support. There's no phone whereby you can reach the driver or company. Case in point: Take Bill an apparently affable guy who will offer you a beverage on the way to your destination. Bill drives a Grand Cherokee and all indicators indicate that he is a criminal or accomplice to a crime. When Bill dropped me off at Planet Fitness I immediately noticed I left my bag containing an IPod and Bose headphones in the back seat. About $600 worth of equipment. I tried to wave him down but he wouldn't stop. Since then I have sent over 30 texts to him, the local Ueber office, and the corporate hub in Stamford. I even asked the Stamford police to investigate. As of this moment neither Bill nor Uebr care about larceny and they have no moral compass or desire for customer service. The car will get you from point A to poing B but after that your on your own. Uber won't lift a finger to help. Do you reaally want to take a chance with this company when you have your wallet, or keys, or handbag, or smartphone, or lose engagement ring on your finger? The smart answer is no. Bill is still out there. Lyft is the same as Uber. I'll check later today but smart money says they are much more conscientious than Uber who thinks its customer service is of no importance, even when expensive items disapper in one of their cars.",1
"First and foremost, in India there is no customer care service from UBER. There is just a help tab through which we can raise a complaint and that will be solved after 24hrs (taking their sweet time to respond). If a customer is in a deep trouble there is nobody to help. That pathetic ""HELP"" doesn't help actually. There were multiple issues I have faced with UBER. But, today it was disgusting. I got ill because of the $#*!ty freshener used in the cab. Apart from that driver had stopped the car in the middle, ended the trip and told me to get down at the unknown place because I was ill. And I was helpless because UBER has only ""HELP"" tab which doesn't work at all at the time of need. He denied to take me to the destination as he had some other work. when I insisted him he told I'll take you to the X place (where he had some work) and then I'll drop you to the destination. He forced me get down. I had to taxi from that place to my destination (Thanks to God I found a taxi over there), by the way I was charged for this trip which was equivalent to trip charge. Who is going to help in this. This is not the end yet. As the driver had ended the trip I was wrongly charged (more than what it is at time of booking) whose fault it was?? Driver was rude & abusive - UBER has ""HELP"" tab for your security. I have raised many requests on UBER ""HELP"" till now no help. One more important thing ""TIME"", nobody cares. Because of abrupt ending of the trip I reached my destination very late. Who is responsible?? This is not the first time I was wrongly charged, it has become usual. IRRITATED, PATHETIC, DISGUSTING",1
"My wallet was stolen out of an uber last night with my social security card inside and this was the message I sent over 4 hours ago and have yet to recieve a response. I seriously question the legitimacy of this company and strongly advise people not to use the app. I have been a big fan for almost two years but I truly believe there is an underlying issue with this company. Any other customer support system would be much more attentive to the matter and have consideration to help their customers with their best interest in mind. To Uber customer support: I received an unusual phone call from your company this afternoon that made me so uncomfortable that I had to hang up. The man on the phone had a hard time speaking clear English and said that he had contacted the driver but failed to Answer any questions pertaining to the wallet, even when asked directly. The phone call seemed like it was coming from over seas. Unless it was a mock phone call, it has made me begin to question the legitimacy of your company. I have spoken with a lawyer, the police, an investigator, and the attorney general's office. Further action on this matter will be addressed within the next few days because your customer service has failed to make the slightest advancement in helping me. I have been in contact with you for the past 8 hours and have yet to receive the smallest details about my driver, such as his last name, despite the fact that your employee has committed a felony against one of your customers. I am extremely disappointed and will continue to inform everyone I know of this situation and the how unprofessionally it has been handled.",1
"I took an Uber to the hospital but left my expensive cardigan in the car. I contacted the driver immediately from information provided in the app. He confirmed he had the cardigan. He said when he is back in my area he would drop it off. I did not hear back for a while so contacted him again. He said he would drop it off to me but I'd have to pay almost £45 for the trip or he ca drop it off at the Uber offices in Canary Wharf. I then asked he drops it off at Canary wharf. I also asked that he let me know the details I will need to collect the item. My fare to the hospital was £7 by the way. Anyway, the driver whose uber user name is ""Abobacar"" stopped responding to me. I contacted Uber and they said they had tried to contact him to no avail. So I suggested that they switch his access off to force him to come to the office but they did not respond to that request instead they pretended they could do nothing and that the driver is self employed so there's nothing they can do. I filed a Police report and the Police said they had a duty to resolve the issue on my behalf. I relayed the message to Uber but they declined. A few weeks after, Abobacar contacted them and claimed he was in an accident and that when he got the car back the cardigan was missing. So I asked if his insurance would pay for the missing item, they did not respond to that. The moral of the story is, if you have a problem with an Uber driver Uber will do absolutely nothing to help you resolve it. They appear to have a finders keepers policy. It is disgraceful. I still use Uber but will switch to a competitor as soon as I get a chance to find one. Also, I will send an invoice to Uber as advised by the police. I will follow up with feedback at a later date. Beware of ""ABOBACAR"" the Uber driver!",1
"Uber use to be great. Remember when you got the first one? It was so easy and convenient. Now, they are worse than taxi's. Surge charging to 2 or 3+ times the normal rate, app crashes, poor drivers, and above all, weak and unhelpful customer service. Now any d bag with a license can be a driver. Some of the drivers even pedal coke and weed thru Uber. Other drivers hit on girls and try to get dates. We had a driver pick us up in his pajamas once. Another driver had a tire blow out and told us there was nothing he could do about it and we basically paid double for the trip since we had to order another uber. This is no longer a company that is in control. Uber use to be great. They use to be the Nordstrom of transportation. Now, you might get the first car you click, or maybe the app will crash. Maybe the driver will wait 10 minutes then call you and cancel the ride because he's stuck in traffic. Once you get the car, cross your fingers for a cool knowledgeable driver but 9 times outta 10 the driver is out of their area and they have no idea where they are. So use gps, but it doesn't help when gps takes you the ""shortest"" and most traffic ridden route. After your trip, hopefully you get charged the correct amount... Or maybe the driver will contact uber and say your trip was longer than it actually was and they will charge you more, which I hear is happening more often now. At least taxi drivers have to work out your transaction on the spot and you know you won't be charged more at a later time. Taxi drivers are also usually driving as a career, supporting their family, barely scraping by. One of my last uber drivers was a real estate agent using uber to give out his friend number to order weed. WTF? Uber USE TO be great. Now, I'd rather just take a taxi. The uber app is convenient, but is it that much harder to dial a cab??",1
"I have been a loyal user of Uber and it has always been my go-to means of getting from point A-B. But today, I've officially withdrawn and deleted their app. Heres why: Two nights ago, I've ordered a cab for my girlfriend to get home after a huge argument around the time of 3 a.m. Keep in mind her phone died at the time. Her destination was from Manhattan to Brooklyn. The next day, she had told me she was dissatisfied with a pool customer who gave her an attitude and told my girlfriend to ""shut up"" after talking to the driver named Raja. She was tremendously upset to begin with and it caused her to get off the car a few blocks later, which took her to the 1 train. We are super easy going people and we have discovered the driver Raja, has NEVER ended the trip at the time she was dropped off- which was only 5 blocks later and had fully taken advantaged of the circumstances and drove an empty passenge car to her destination in Brooklyn. I did not fully realize this until it was too late - so I had rated him 5 stars before I got the chance to report him. Again we were in an argument so we didn't not talk until a day later. First of all she and I were not drunk at all. And I have reached out to uber and they have refused to refund me for the amount of $27. Although the money is not the issue but the dishonest driver. I will be going to Lyft from now on. I do not regret my decision. Also I notified uber and told them the details and these illiterate workers reviewing my complaint do not even respond to the problem but are confusing that I want a refund because the fare amount itself is wrong. I regret to say that Uber hires lousy drivers that take advantage of customers at 3am. and if they had looked into my transaction profile, I already spend quite a lot for cabs, theres no reason for me to go beyond for 27$ unless it was the truth",1
"Uber driver was late and stopped 50 meters ahead of where he was supposed to be. We wave him down but he doesn't come. We call him, he doesn't talk but hangs up then a couple of seconds later starts moving towards us at 5km/h I question if he is ok when he arrives as he seems either drunk or sleepy or just completely spaced out. I don't want to risk the lives of myself and my partner and her  5 year old son. Driver gets aggressive and doesn't want to drive us anymore after we waited for him for so long. I tell him not to yell as he is scaring the 5 year old and its at this moment that he cancels the trip and orders us to get out of his car. The 5 year old boy is getting out of the car with one leg on the ground when the driver decides to accelerate. This fool is playing a game with his 1500kg car and a 20kg child. We yell at him and I put the car in park so that he cant harm anyone. We advised him we will be taking it up with the Police. Its at this moment, like an infant, this driver begins playing the victim and starts pacing around his car while its in the middle of the road with doors open and hazards on. A tantrum for the adult who realises what he has done is wrong and illegal. I have contacted uber and am awaiting their call. If I'm not happy I have an active social media presence and will escalate to the proper ombudsmen as well as the police. I REALLY hope uber do not defend this dangerous and irresponsible individual and resolve this quickly. Very very disappointed and angry,.... edit: Update - uber customer service (if you can call it that) is abysmal. They are siding with the driver and banning the passenegers account whilst not revealing ANYTHING about their 'investigation' hiding behind their privacy policy. strongly considering posting the pics and videos of the driver and his car online. Customer service rep was Abhi who didn't provide us with any resolution and in fact just made things much much worse. Please don't pretend to care about dangerous behaviour if you clearly don't...",1
"We called an Uber to head to the San Jose airport as we often do. Our first driver showed up and asked us where we were going and we said San Jose airport. Immediately he said he is ""going to have to pass"" since he wants to get home soon. He didn't want to take us that far. I find this appalling - the airport is a 18 miles, 20 minute ride away. If he didn't want to accept passengers then why did he accept our ride? We wasted 8 minutes Waiting for him for nothing. We then called another Uber and she came after 5 minutes. She also asked us where we were going and when we told her the airport she said she had to pass because she didn't have proper authorization to make trips to the airport. Needless to say we were pretty pissed at this point but decided third time's a charm. The third driver was 5 minutes away. We called him right then and there and specifically asked him if the airport as a destination was going to be a problem. He said ""I think it's ok"". Then a couple minutes later we got a cancellation notice. That is THREE DRIVERS in a row that refused to give us a ride based on our destination. It's not like we were asking to go 100 miles away. SJC is the closest airport to the Fremont area and there was no traffic at this time of day. We ended up using Lyft and even with a 75% prime time charge, we knew we would get reliable service and a driver that was courteous and would take is to where we needed to go. And that is exactly what happened. Our Lyft got us there swiftly and with no issues or complaining about the destination. Uber, you have LOST this customer. I find this appalling and completely unprofessional. One cancellation I can maybe understand and brush off as a specific driver issue. 3 in a row means there is something systemic going on and that your customer service model is broken. Take care of your drivers so they take care of your customers. Completely unacceptable and unprofessional. Doesn't seem like there's enough reprimanding for drivers canceling on riders. Use Lyft or alternatives and stay away from Uber.",1
