text,label
"Orders aren't filled in order of being received. Drivers can chose which orders they want to fill and which ones they don't. We ordered Taco Bell that is 5 minutes from our house and after 2 hours and 2 times calling the company with no success, we canceled our order. They said we won't get our money back for 3-5 days. That's crooked as heck! Terrible company! Terrible Service!",1
"I don't know how GrubHub stays in business considering how often the screw up orders. This last time I ordered the driver went to the wrong address so they canceled my order because of a difference in ""mileage."" Hope the driver enjoyed eating my food! Completely ridiculous company with some of the worst customer service I have ever experienced. I've been treated better at the DMV.",1
"I've given Grubhub every opportunity. In more than a dozen orders, they have never gotten it exactly right once. Late, lost drivers, wrong orders, orders canceled after I've waited 90 minutes. And their pathetic attempts to make up for their goofs are borderline insulting. I'm out. I've placed my last order. If you want food, correct and on time, go elsewhere. These guys are the worst.",1
"I left the driver perfect instructions on how to get into the gate and they had my correct address. I missed the phone call from the driver and they left. So because the driver can't use GPS or type in a gate code correctly - Grubhub ""couln't give me a refund"" and seemed to care less about what happened.  ""Grrrreat"" customer service Grubhub. The customer is never right must be your motto.",1
"Ordered lunch at 10:15.  Delivery was for 11:15, 11:25.  By 11:50 - nothing.  App said still being prepared.  Had to chat with customer service, they called restaurant, said another 10 minutes.  15 minutes later getting a call from a driver asking if I could come get it, no parking.  Are you kidding me?  For lunch, ordered hours earlier, couldn't deliver or update - terrible.  Avoid this service.",1
"My daughter and I were home sick yesterday. She is 16. She started feeling better in the afternoon and ordered food via grubhub. The delivery was made however he started asking her inappropriate questions ...., her age, why wasnt she in school?  Thank goodness I was home and could step in however when I called Grubhub they said the delivery was from the restaurant ....  be careful in ordering food!!!!!",1
"The first time I tried Grubhub I ordered almost $40 worth of food and was delivered a tiny appetizer despite the receipt in the bag being correct, and was refunded only half the cost of my order. The drivers call my phone confused and lost every time, despite the detailed delivery instructions I provide on the website, like they haven't read it or don't know how to. Don't waste your money with Grubhub.",1
"Tried to order a pizza through Grub Hub. We never got the pizza. They goofed up our phone number. They claimed the pizza was delivered when it wasnt, then when their customer service was called for resolution, they refused to give a refund. the only thing that they would offer, was 2 separate gift certificates that could not be used together. Absolutely and Utterly ridiculous. Will never use Grub Hub EVER again.",1
"Drivers don't read or follow explicit delivery instructions. I am wheelchair-bound, so delivery instructions are critical. If food is left at the wrong place, I can't get it. Repeatedly, this has happened. Rather than get the driver back here ASAP to correct the delivery mess-up, the best Customer Service could offer was store credit. This is not satisfactory customer service. I'll never use them again... and neither should you.",1
I have never been so angry about an online order ever. This is an awful site and terrible service all together. I ordered my food and it only came to my door steps two hours later. Also there was food spilt and the food was cold. The order was completely messed up they put in all the wrong things. Cannot believe how awful this experience was. I truly wish i had read the reviews beforehand because then i would've spent my $52 elsewhere,1
"Used them two times both times  Late, wrong items ordered and cold. A winning combination. Don't use them get off your butt and get it yourself. Grubhub doesnt care about the customers or they would give some training to there subs/ delivery boys & girls. Both times the deliveries were done with people that didnt speak English. If you need some help Grubhub  I could help I run a fortune 500 company. Both times i received refund how are they making $$$$",1
"They put all the cold and hot food in 1 bag, my salad, ketchup and ranch was warm and my hot food was cold. Got a message saying it was leaving the restaurant, and would be here at a certain time, came 30 mins after it was suppose to be here. So not the restaurants fault cause I called them and they said thats how Grubhub does it, they put Hot and Cold food in the same bag and others have complained it wasnt on time. Sucky delivery method. Should have picked it up.",1
"When you pay over 50 dollars you expect to  at least receive your food. If I am a driver and they hand me a small bag from IHOP My first thought would be "" There has to be more "". It would only be common sense.  I gave a 20 percent tip for this? I will never opt in for a tip until it is deserved from now on. It seems  the driver is only concerned about their next order and not the one they are currently on.  I would add a photo of the food except I never received it.",1
"If I could give a negative number I would. The restaurant we ordered from is 0.4 miles from our house.   The food was cold & took nearly 25 minutes to get here. The driver was so rude. She called & wouldn't even speak with me. She hung up on me. FYI, my name was on the credit card & the phone she called. My son was outside waiting for the delivery.  I called the 800 number to complain, he was a useful as a box of rocks in quarry.  I wouldn't ever recommend GrubHub to anyone I know.",1
"I placed a schedule delivery for 9:15pm around 7pm and my order my never picked up from the restaurant. I called Grub Hub customer service and they stated that 5 drivers rejected the order probably because I didnt put a tip on the order. I told them that I give cash as a tip. I was told that they will try and find another driver and its already 10pm, restaurant is closed. So basically Grub Hub had to cancel my order. There should be an option to choose cash a tip. Horrible service!",1
This service is probally the worst there is. I ordered food 4 miles from my house and took an hour and a half. The driver had it in his car for almost an hour. When I called to find out what was going on I was constantly put on hold. When I asked for a supervisor I was told I could leave my number and get a call back in 24 hours or wait on the line for 5-10 minutes to speak to one. When I did speak to one there was no apology and she did not follow through on her promise. I would suggest Uber eats.,1
Nothing but a headache! Placed the order which was said tone delivered 20-30 minutes later. Received 2 notices of delays without explanation. After an hour called the restaurant and food had been ready for over 30 minutes but no driver pick up. Grubhub tried to blame the restaurant on the 3 call and promised delivery within another 15 minutes. Desert was made 9o minutes from ordering and it was wrong plus drinks missing. First and last order with them. Don't use them; business model doesn't work. Money wasted.,1
"Order was extremely late, never got a call it was on its way. Order was wrong, and we didn't get what we wanted. Called to get it figured out. Took over an hour on the phone to get it straightened out. They agreed to send a driver out to get our new food! Hours went by and we never got any food. Called them up again and customer service didn't do $#*! for us, even the second time around!  Never going back, don't give this junky site your business, they don't deserve another penny of your money!  Sincerely,  Disappointed",1
"I placed an order for our firm at 9:37 a.m. for a noon delivery. The order was ready at the restaurant at 11:50 a.m. and waiting for the driver. At 11:15, the order was still ready at the restaurant and waiting for the driver. I called GrubHub and they called the driver. They said she was very rude to them and they were really sorry - she was leaving the restaurant right then. My order place at 9:37 a.m. for noon delivery, arrived at 12:30. Grub Hub offered a $10 coupon for $60 worth of food to arrive late and only warm.",1
"Three times I've tried this service and three times I've been disappointed (in two different states so I can't blame the area that we're in). Twice my order has been so late that it was cold, soggy, and inedible and ultimately refunded by GrubHub. The restaurants have all be fine to work with (one actually called to let me know that the order had been waiting on the driver so long the kitchen decided to remake it) but the delivery drivers and the customer service staff are useless. I won't be giving them a fourth chance.",1
We place an order through Grub Hub and after more than an hour late and many phone calls to the restaurant we learned that the food was ready a half hour before but the Grub Hub driver hadn't shown up and never did. When we called Grub Hub to find out what was going on they HUNG UP on us. In the end we went and picked up our own food at the restaurant. If I owned a restaurant I'd hire my own drivers and FIRE Grub Hub. We will NEVER order through Grub Hub again after this experience. It's true: it doesn't get any worse than this!,1
"I GrubHub drivers calling me and when I don't answer they just leave with my food. Or, they call and then when they get to my front porch they bang with their fist on my door and ring the doorbell repeatedly. All I get from GrubHub when I call to complain is that I should put something in special instructions. But, that never works because no one reads it, apparently. There's another service in my town, although they charge a lot for delivery. But GrubHub is not worth the aggravation. And, they treat their employees lousy as well.",1
"They tried to get me into it after they acquired eat24. I actually really liked eat24...Well, they don't deliver on time and many times they don't even deliver your food. I've had horrible experiences raging from food taking 4 hours to deliver from 4 blocks away from me, to restaurants that give me food poisoning, drivers delivering only part of my items, to food that never arrives (x3). Why do I keep using it? Because they have restaurants that don't get delivered by doordash or postmates. Lately, I've been wondering it its worth it",1
"I have been very sick this week so my husband used them an hour ago to get us food from Hooters so we wouldnt have to leave the house. It took over an hour to get our food. The food was cold , we were missing several items, and when we called grub hub back they told us that they would not go pick it back but refund the money. I called the restaurant and told the lady what I was missing. The lady informed me that she did in fact put those missing items in my bag. Not sure who is to blame but I will NEVER use this horrible company again",1
The delivery driver calls waits for 5 minutes and then drives away. He did not come to the door and that's what I was waiting for. Isn't that apart of their job? I tried calling back to get customer service and their just as worse. Saying there's no way to give me my money back nor can they get in contact with the driver that just left with my order. When I finally tell the guy let me speak to a manager he then offers me a refund. It took 20 mins on the phone just to get a refund and it's going to take 3-5 business days not including the weekend (it's a Friday),1
"I find it disturbing that I am a loyal Grubhub customer and waited from an order placed at 6:15pm-7:41pm and still never received it the driver told customer service they dropped my order off at the office... there is no office I live in a house which means they took it to another house In my neighborhood, I think that's very very unprofessional. I deserve something more than a refund I am a pregnant mother of 2 who is on bed rest and relied on Grubhub to follow through with my order. I honestly feel like the driver ate my order. Smh  On Dec 12, 2018, at 7:41 PM",1
We ordered fast food from Chick-Fil-A. The driver arrived a hour and a half late. Our food was ice cold. When I called the Grubhub customer service line to complain I was offered a credit. It was obviously a lie as it has not appeared. None of this was Chick-fil-A's fault. It was all the worst EVER Grubhub service from the driver to whoever answers their customer service line. What a ridiculous encounter for a fast food place!!! We haven't ordered since. I'm not sure we will. I'm starting to realize this company doesn't care about their customers only the almighty dollar.,1
"We ordered from a local restaurant and the delivery time was approx. 45 min. to 1 hr. After checking the email receipt and clicking on ""Track Order"" we discovered the delivery time had been pushed up to 1hr 45 min to 2 hrs. We called the restaurant and were told the order was ready, GrubHub had been notified but their driver had never shown up. We called GrubHub and found they hadn't a clue what the situation was so we canceled the order and ate something else.  At least they canceled and refunded quickly, they must have had a lot of practice. We will NEVER use GrubHub again.",1
"I waited 3 hours for my order. Support Services game me a coupon for ""next time"" like there will be one. When the delivery man got here he was trying to ask what my apartment was hung up on me as I was telling him. (Keep in mind the order already has my address and apartment number on it) It was a simple sub from a fire house subs 6 minute drive a few blocks away. They messed up my order I simply asked for no tomatoes on the extra comments section for the order. I was really sick I could barely walk yet alone go driving. I figured i'd try an ordering service HORRIBLE experience.",1
"I have had at least 7 incorrect orders, 5 deliveries of cold food, and 9 deliveries that were 45 minutes or more past the projected delivery time. The drivers are lazy thugs. They all wear bedroom slippers and act like they are doing you a favor. Twice they walked away before I had hold of the bag while they turned to walk away talking on their phone. Food hit the pavement. Get your ass off the couch (if you can) and DO NOT PAY THESE FOOLS. Hell, I live in the ATL and one of these MOFO's is up for murder right now for shooting an unarmed Customer. Check the news in ATL 12/2018. 4 real.",1
I well never order from GrubHub again I never got my order or a refund I spent $53 on food I never got we waited for about a hour and called them they said the food should be here any minute 30 minutes go by so we received a text message that or food was delivered at 815pm but we never got the food so we called them back and they put us on hold for about 15 minutes they come back on the phone and tell us the driver went home for the night and we could not get a refund because the driver called us 3 time's and was outside we never got or food and can't get or money back im so mad and will never use GrubHub again,1
"Place order at 10:30am for a 12:15pm delivery.  Tracker said order was delivered at 12:04.  It was not.  Checked with IHOP and they stated that the order was picked up at 12:02pm.  Spent 30 minutes on live chat - and got no answer as they ""were trying to locate the driver.""  Called Live customer service.  Another 10 minutes on the phone.  Unable to reach driver.  Asked for a refund!!! As a diabetic eating at scheduled times is critical.  Wasted my entire lunch break track food I never got.  My blood sugars dropped to 59.  A friend ran and got me a coke and gave me a banana That she had not eaten.  Let's see if they issue refund!",1
I have been ordering with grubhub for years all over the country for work and personal. Tonight I started  ordering dinner at 615pm and at 710 the delivery driver brought me someone elses little order and I was feeding my whole sick family after working all day. Called them asap and by the time they got the restaurant said it was too late cause restaurant was closing in 20. Refunded my pay and gave me credit. So. I ordered from another restaurant and 70 minutes later they cancelled my order and not only did they only give me a $5 credit but by 940pm all restaurants were closed and I couldtn even order pizza.. will never use them again,1
Twice in one week!! I was hopeful I would get good service.  The driver took 45 minutes to drive 1 mile and called to ask me to meet them. Hmm - I paid for a delivery fee and tip! When I told them where to park they took an extra 15 minutes. So GrubHub gave me a $5.00 coupon. Tried again today.  Driver actually came to my office but after a 45 minute drive the food was cold and she brought the wrong food.  I let GrubHub know - they blamed the restaurant - and then said they would issue a refund for the missing food.  They do issue a refund - less the $5.00 coupon I used for previous bad service.  They can't seem to get their act together.  BUH-BYE Grubby GrubHub!,1
"Tried to use this app last week while on vacation in Las Vegas. Tracker told me my order was delivered only it wasn't. The driver told me it ""wasn't her problem"" and hung up on me. Really? Whose problem was it? Mine? No. I contacted grubhub directly and asked for a refund and was told they don't do that and could only give me a discount code even though I live in small town Idaho where Grubhub doesn't even exist, not that I'd use it again anyway. I just think a refund for a pretty expensive order that was never delivered should be an option and it's bs that it's not and that I was treated so rudely by the driver. Denise in Las Vegas should look for a different job. Awful experience.",1
"So my first use of grub hub was about 2 years ago and my food took over two hours to get to my location and the food was cold by then and not worth the money. So giving this food delivery site another chance about 4 months after the first time I ordered from Grub Hub I tried again. Once again it took forever to get food that arrived warm this time but since it took so long I did not give the driver a tip, and he was upset. So with me wanting to give this site a third chance I tried again a few months ago. And once again I was let down by very expensive prices to deliver food that shows up way late and barley warm. So Im officially done with Grub Hub, have them three chances and that was enough.",1
"I personally don't like nor do I trust using apps for food delivery; do the traditional way with calling the restaurant directly or pick up take out at the location. One of GrubHub's drivers never made it to the restaurant my husband and I ordered from, made us wait for over two hours: during that time my husband called the restaurant regarding our order, and then the driver claimed/updated the app that our food was delivered when it wasn't. My husband then called GrubHub and explained our situation and all we got was our money refunded. Personally I think after that situation we're owed a free meal paid by GrubHub, but I'd rather leave this review and spread the world to NEVER use this app or do business with GrubHub.",1
My food was an hour+ late the kid showed up stoned out of his mind. I'm pretty sure he picked up my food then when and got baked hence being so late.  The queso had been dumped all over my chips and due to being so late the chips were all soggy. the food was cold and the driver didn't even apologize just stared at me like he was expecting a cash tip which i paid with card so unfortunately I tipped him anyways which I wouldn't have. And all I got for almost a 30$ meal was a 5$ off coupon for food I didn't get to enjoy at all. In fact I ended up having to go get something to eat from the gas station. Not only will I not suggest GrubHub I will not be using it again this was the worst experience I have ever had with a delivery.,1
I am mother of a very active toddler . I work long hours and dont have time to come home and cook. I decided to trust my gut and order from food to be delivered from Grubhub. I placed my order and waited two hours  for my food. Come to find out the driver lied about delivering my food and I told the customer service team . I asked if they track their drivers they claim they do not they dont . I called the restaurant to see if anyone came but they never showed and my food sat there. I managed to scream my way to a refund . And the restaurant also said I had to pay in person for my food if I wanted it. So lesson learned Grubhub is the worst company around for food deliveries . I will never use their services again and I hope there corporate office gets this,1
"Delivery driver claimed to have attempted to make a delivery, he said the business looked closed. We are located in a building with several other businesses with a big sign that says our hours and to knock. Come to find out, the driver's for Grub Hub get to keep the food if it's not delivered! So why would they put forth effort to locate your business??   After this I called to get a refund, they told me they would email me with the coupon codes. Never received email. Called again to just refund my card and say forget it, they then said only credits can be issues since we missed the delivery...this delivery service ( I use that term loosely) is a joke! If we're going to be screwed over, we at least want to feel it!!!!!!!!!! We'll stick with Bite Squad from now on.",1
"Normally I would never right a review like this however Grubhub was so incompetent tonight that it boggles the mind. After I placed an order at 9 I received an email at 11:45 (an hour past expected delivery). It revealed not only was my order canceled BY GRUBHUB, not only were all of the restraunts in the area closed, BUT IN 3 HOURS A DRIVER NEVER PICKED UP THE ORDER. IT TOOK THEM 3 HOURS TO TELL ME THIS. I am litterally so  hungry RN and cant get food because this took so long. The worst thing is that I might view this as a one time issue except for the fact that THIS EXACT SAME THING HAS HAPPENED TWICE BEFORE.  A 5 dollar discount which expires in two months i not enough. I litterally did not eat tonight because of this companies incompitance and I am deleting the app.",1
I placed an order for pizza to be delivered to my daughters birthday party. I received email confirmation of delivery.  When I called the restaurant to confirm they did not have the order and told me the order would not be prepared in time. I had to re order and the driver was 45min. late  we had to go to a different restaurant to get pizza before the kids left the party. I received an email from grubhub stating it was their fault they did not send the order tot he restaurant and offered me a $10 gift card.  I had over $100 in pizza ordered they admitted to screwing up - no apology only a $10 gift card for my inconvenience.  Not worth the stress and hassle - call the restaurant  directly much easier.    Grubhub - great idea HORRIBLE business  and even worst customer service.,1
"I ordered from this site many times, even after they screwed up.  I was new to on;line delivery, and I was trying to be nice, and give them a chance to get their act together.  But they never did!  Each time, they got worse and worse, until I finally gave up on them.  Delivery was dog slow nearly every time.  The delivery people didn't speak English very well, and they would argue with you when you complained.  That didn't even do any good, because you couldn't understand half of what they were saying!  The first few times, the driver got lost, and I had to go online to a chat agent to correct the situation.  That even took time, because they were always busy with other customers.  I don't know who runs this company, but someone there needs a swift kick in the rear end!  These people are awful!",1
"I placed an order an hour prior to me taking my lunch at work. It was 12:15 p.m. The expected arrival time was 1:00 -1:10 p.m. I check around 1:00 p.m. on my order to see if it was on its way, and the order showed delivered!! I called GrubHub and the woman checked on the order for me, she could not locate the driver so I waited on the line and finally at 1:25 she said that she could not locate the driver, so she asked if I wanted to send another driver. I was about to hit my 6 hours at work and had to take my lunch asap so I told her I would pick the food up, and all she said was ""ok"" and hung up. I am not the type of person to ask for free meals or anything because I know what it is like to work in customer service, but I know when to offer a customer something when they have received very poor service!!",1
"I ordered dinner for myself while working at a motel. I put in the correct address for delivery (as I have done several times before without incident). Work got busy for a few minutes, and I was unable to check my phone. Within a 10 minute span, I had three missed calls and a missed text from Grub Hub, informing me that the driver was attempting to get a hold of me. Ok, thanks! So I called the customer service line to get in touch with my driver. They tell me the driver couldn't wait any longer so he left, and I was not entitled to a refund. I never saw a driver or person approach the lobby, so apparently this person tried to call, couldn't get through, and instead of coming up to the damn door of the address that was listed on the order, decided to just bail and, I guess, what, throw my food away? Sweet dude",1
