text,label
"I will and always have admitted, it's not about loyalty but business. I supported uber in the past because they were getting the job done better than the cab companies. And in a sense they are still more efficient than the dying breed of the cab industry. However there are and will continue to be more rideshare business. Look what Napster did to the music industry and look where Napster is now? Uber has gone down hill for me as this whole rating thing has gotten out of hand. I am on time for my driver, respectful (treating them the way I want to be treated), and despite not liking the tipping I still do it. I don't like the rating as it's pointless. If I give the driver a bad rating legitimately they will and have rated me poorly. Anything less than a 5/5 for a driver is ""wrong"". So the passenger gets bullied into giving them a perfect score. Then there is this tipping which I have been in the service industry and support it but UBER was all about the no tipping and now if you don't tip enough or worse on time, the driver rates you poorly. Personally, I don't care if a drive likes me or not but when my rating can impact me getting a ride, this is where the problem is. Some examples I dealt with is I had a driver in Montreal who didn't speak English and I did the best I could to communicate in French and so my rating goes down. In Phoenix, my driver was soliciting his private driver business and when I couldn't use his same thing. And most recently in Seattle one driver was so depressing talking about how she has no friends and that she doesn't know Seattle well. I had to end up using my own gps using international Data and yet now I get a bad review. I was scared to give this lady a 4/5 yet alone worse. And I have gained other example. I have supported UBER coming to Calgary and Edmonton, even when they were booted out temporarily. Now that I live near Vancouver, I was supporting them coming there as well. Now, I'm starting to change my mind. My point is now I'm considering going with other options including the awkward hailing of a cab! Regardless, ride sharing will continue to grow, the question is, will UBER be a part of this or eventually not exist like Napster, being just another company that started a trend? FYI they make it hard for you to contact them with complaints unless you say you were in an accident.",1
"I use Uber in China, Australia, India and UK and have found them to be reasonable up until now. I took an Uber in Brisbane recently and the driver was terrible. My female companion complained to the driver about his erratic unsafe driving in general, his ignoring of the navigator, ignoring of directions. Uber driver, knowing he would get a one star rating, then complained about us both making 'racist' remarks. I have no idea of what nationality the driver was, it was not even on my radar. My companion sits on University Boards and other Government agencies and is listed in top women business leaders, I also am on similar boards, travel extensively through Asia, Europe and India, we both have no racist comments to make, but we are immediately, according to Uber, guilty. Uber suspends account without discussion with me and then after only sending condescending patronizing emails 'about their community' as they are now also the new warrior and standard setter of community political correctness and protector of multiculturalism, supposedly 'unblocks' my account but it will not work. Despite trying several times to contact them to resolve, emails are answered, one of our team will be in touch, still waiting. Uber's arrogance knows no bounds, they answer to no one but themselves, they are not only condescending in their attitude, they make public claims which they do not back up. As they have to answer to know one except their own falsely manufactured 'community' which standards are set by a mutli-national based on profits, not moral or a code of conduct that has checks and balances denying a process for right of reasonable reply nor natural justice to their passengers. Their complaint service is purposefully designed to avoid human contact so they can make their morally one sided incoherent biased judgement in complete isolation and then make unfounded derogatory unable to be replied to judgments that if I knew who it was I would complain to the HRC. As they have no responsibility to local authority nor reasonable codes of contact and conduct, do not expect a fair go from Uber and do your best to out them as a self serving corporate usurer of community standards for their own profit motive while making false claims against real people of high standing in real communities, expose them for the hypocrites they are. Similar opinion? Write a review!",1
"Really Disgusting! This is the condition of National Capital Region, the biggest frustration people facing here is conveyance and moreover traffic. Nobody is hell bothered about 9-10 hours of jobs extending to 12, 13, 14, 15 hours and so on. A person going to office or market thinks to book Uber/ Ola, the first question the driver asks is DROP KAHA KA HAI- i.e. Where is your drop location. Whereas, its clearly mentioned in Ubers rule book that the driver is not suppose to ask the drop location, not a big deal the rules are as fake as the company is. After waiting for 10-15 minutes, either the driver switches his mobile off, or standing at one position he will say that I am not able to track your location or even he will just sit over it and cancel the trip after 15 min with no intimation. This is not something that happens once or twice a week, this is something that happens twice/ thrice a day. Then for all the cancelled trips they will deduct 80/- (per trip), now if a person doesnt have the time to write them the incidence happened, they will not even return the money back. Even after my last complain to uber, I attached the screenshots and sent them, these people apologized and gave me vouchers to close the matter and said that this will not happen again. But what next, everytime I should write them such detailed mail so that they pay attention to this, they dont even have a customer care. Moreover the driver has the guts to say that JAO KAR DO COMPLAIN or Okay, Jisse kehna hai kaho. Because what worst, just that they will not get the days incentives, nothing more then that. Everybody is just into money printing business, and who is the sufferer, just the common man. Frustrated person, at last when goes to an auto wala so either he will be on strike or he asks for money as per his choice, because there are no rules. Nobody is there to check. Why is the common man working so much, just to get frustrated and depressed, for he is helpless for so many things and at last he should be happy that he has money to get admitted in a branded hospital. Anybody in India can strike for any non sense thing demanded, what should a common man do. Leave all his work and strike for the thousand things that he has to face because of wrong people into business. What is the government doing. Meru and mango are out of business because of uber and ola. If this will be the case, the day is not far off that even uber and ola will be out of business.",1
"I had just arrived from the airport for my trip and was super excited to begin my vacation. However, my friend and I called for an Uber...which I highly regret now...that totally switched my happy mood into pure frustration and put me into the worst mood possible... My friend had took my phone to call for an Uber. The Uber driver was very poor at communicating his destination. After waiting around for a bit, we told him we were at the gate that he told us to be waiting for him after running there in a hurry. He was very short and rude in the manner in which he communicated. Once I told him we were in arrivals, he told us that he said to be departures and cancelled the ride, and Uber had to audacity to charge me for NO service! In the normal world, when people arrive at a destination from a flight, they get picked up in ""arrivals"". I tried to contact Uber, but apparently they do not have a real phone line to call customer support. Trying to get my money back was such a pain and ruined the whole start of my trip. All I wanted was my money back, and I probably would have been fine and a little irritated about the experience but probably would of still continued to use Uber if they had simply refunded me....However, they would only give me ""Uber credit"" to use on my next trip and still charged my card. I told them to remove the charge from my card, but they said that was ""against their policy"". I have talked with a few others that have similar situations happen to them, and they were able to get full refunds for their charged cancellation...but I don't know why refunding my card in particular was against their policy. Seems as if the company picks and chooses who they want to refund...which wouldn't qualify as a ""policy"". I guess they would prefer to lose a customer to a competitor than refund a simple $5 cancellation. That simple $5 costs them close to $200 in lost revenue just for that weekend with all of us using Lyft and other transportation services instead. My first Lyft ride was really great, the driver had even given us complimentary waters and protein bars and his car seats were actually cool massage chairs! Back to the point, Uber is not a good company...there are sooo many things that are wrong with them aside from stealing money from customers. They prefer employees that are greedy and will do anything at all costs to get ahead. I'm not just referring to the drivers (some have which have been nice to me on other occasions), I'm referring to the corporate dogs that devalue everyone around them. Here is a link to an article if you would like to learn more about the toxicity of the Uber culture... https://www.mediabistro.com/employer/blog/news/travis-kalanick-king-hr-fails-finally-ousted-uber/",1
"It's been 2 years that we are using uber, but the kind of issues we have faced in past 2 months have totally washed away the past 2 years of good experience. I'll explain the major episodes- 1. Maruti Ritz- Me and my husband were travelling from sector 57 gurgaon and sec 14 gurgaon, my husband had to get down at huda city which was midway. There are 3 ways for this route, when we asked him to take the huda route he said i can't do this otherwise I'll be in loss, I'll move according to the navigation. We told him that this concept is for car pool, but he continuously kept on saying that you don't know, i am the employee i know. He continuously kept on howling ""mai apki wajah se apna nuksan thode na karaunga"". After damn frustration we asked him to call the customer care and ask, even after knowing the fact, what he again misbehaved and said that ""hum aisa isliye karte hain taki ap baad me ye na kaho k galat raste pe le gye navigation k hisab se"". He was not silent for a min till 3/4th the way. This is highly unacceptable. 2. We both had to travel from gurgaon to delhi, it was sunday eve not too much traffic also. We booked uber thrice. The first driver 6:08 pm when we called him after 5 min he said that he cant go to delhi.. in car pool its not possible. Second driver 6:14 pm, we called him within 2 min, he also asked where u hv to go, i disconnected the phn. He again called to ask the destination, i didn't tell. He said ok, he was jst 5 min away, we kept on waiting for 10 min, no response,.when we called to check, he switched off his phn. Then also we waited and kept on calling for 15 min then finally he cancelled the trip. Third driver 6:39 pm- he too was just 5 min away , for half an hour he kept on saying that i m searching whereas he was not. At last we asked him to reach rail vihar the nearest landmark, its clearly seen in the map, finally he replied "" madam mujhe search karna nahi ata"". Then i shouted and said that i am going to make a complain, he was at rail vihar within a min, bt we had already cancelled the trip. We were late by 1 and a half hour, moreover we were damn frustrated. Finally then i booked uber from my phn and we got the cab. 3. Today in the morning, i made a request for own car from sec 57 to 14 gurgaon. A driver mahinder, hundai accent accepted the request and said that its in pool and he is going to dwarka delhi. The rider he was having was also saying that i didn't opted for pool. He asked me to cancel, so i did. I was booking it for office, in hurry. I again sent a request and again he only accepted and when i called him, he replied i have to take this request otherwise ""meri ye trip waste ho jayegi"" i don't know how. I said i havent opted for car pool, I'll be late for office how does it matters to me k apki trip waste ho jayegi. So what he replied was, he actually shouted that ""to mujhe kya farq padta hai k apko late ho raha hai"". I have actually referred uber to many of my knowns, i now feel like writing these reviews everywhere. This is just not acceptable. These are only the major issues that i hv mentioned, and it actually doesn't matter if u cut their day's incentive when we are facing so many issues with so many drivers. They take advantage of your 6 trip incentive method and it will deteriorate uber's image, u should make it km based incentive method Uber is working only becoz of customers. Dont lose them.",1
"They lie to you, cheat and steal. Do not drive for them. They will not honor what they say or owe you.",0
Uber is totally taking advantage and overcharging! They charged me over $100 for 10mile ride! Ridiculous!,0
"Car went to wrong address. Was filthy. Charged me 3 x the estimate!!!!!! Never again. Crap, crap, crap, crap.",0
"They will fail eventually. Few years from now, Uber will be a case study in business classes for bad execution.",0
"I went 12 miles and they charged me $95.00!!! WOW, I must have been on a chariot of gold and didnt realize.... wtf.",0
the meager savings you get are not worth the hassle of trying to use this stupid system. Take a real cab or shuttle.,0
"I waited 40 mins and no taxi, I had to get another but uber still charged me for a ride never took. they are thieves",0
Uber/Lyft drivers need to know all the facts about doing this work. Hardly anyone is making money. Uber is preying on,0
I have comment about the rating system its not fare and its not based on fixed points and work is not stable with uber,0
I was charged $80 for a 10 minute drive which would have cost me no more than $30 by taxi. I will not use uber anymore.,0
Nothing good about uber Use  ARRO   app instead download ARRO on your phone much better then uber no surge pricing ever,0
I see there are four cabs near my home still 2x surge !!! Switching to Ola. If this continues uber will shut down soon.,0
I got an estimate fare which said my journey would've between £23-£31 but got charged £53. I complained and got nowhere,0
They rip off customers riding from NJ to NY with a 20$ surcharge and don't bother to let them know in advance. Screw uber!,0
I am uber driver uber just think about own company no support drivers plz think about then start uber its bull $#*! company,0
The service and availability is good but they put exorbitant fare almost every day. Practically useless for daily commuters.,0
I got a 7 mile ride. They charged me £32. In the past 15 yrs the most I have ever paid is £12. The guys are modern day criminals.,0
Uber charged me 159.00 to take me 7 miles down the road on 12/31/15. Price quote was 41.00. I will NEVER use their service again!!,0
Thay will try to suck u in with a little cheap rates thin one waaaam got charged 1000 dollars for the same ride beware of this app,0
"I've wasted several hours of my time trying to register for this app. It's a scam. The support desk is completely incompetent, too.",0
"Had to walk, why would I ever try and contact Uber again? I'm happy for the people who use and save money instead of a taxi. Stupid.",0
The surge pricing is a huge scam! I was charged $93 for a $45 ride in a car that was falling apart! I could have had a limo for $85.,0
uber is nothing but a fraudulent piece of shi t low life mother$#*!in thieving dog$#*! useless leach sucking peoples money dry $#*!I EM,0
I hate this album ap more than any other. It so often ends up in the wrong pick up address then the call driver function fails. I hate it!,0
They charged $180 for a pickup of less than 20 miles. Exorbitant cost. Estimated cost prior to pick up at $80 and charged $180. NEVER AGAIN,0
"Why the driver have to give to Uber personal information of private bank account ,l my sure they don't give company bank account information",0
"Cut driver fees want them to drive more put more wear and tear on for less ,Won't add a tipping to App . Its not worth it ,stay away people.",0
"You can't check price before you book... I signed in, requested a price for the NEXT DAY (airport to hotel) and they charged me $5 for no show.",0
"This is the worst company I ever had to deal with. They give you one price and charge your card another. BEWARE OF THIS COMPANY, TAKE A TAXI...",0
Map is not working! I had to call both the passenger and driver to track them! When you have children riding in Uber you better have a working map!,0
DC: requested UberX and was Automatically slotted to UberPool without a chance to decline. 30 minutes late for a business meeting. Switched to Lyft,0
"tried to sign up, this is what happened, not sure why they have banned me :-) the post is quite funny and you can find it here https://goo.gl/gNALhT",0
"Overpriced for going small distances, treats employees awful, let's underage children order rides. Find better service they just f$#@ people all day",0
AWFUL experience... fro OHare to home in double time! Didn't know that pool gives them the right to drive all other towns! Will not use them against!,0
I left a bag. It took a long time to answer my call. Their computers were down. Left my number. No call back. I just want my bag. No response. $#*!s.,0
Urber is awful to work for. A US Army veteran had his job taken from him because of a bad rating what the heck is that ? DO NOT WORK FOR JIVE TIME UBER,0
Is there any way to get this info to our legislators? My son didn't know about the surge ripoff factor and got took for a $117 6 mile ride on New year's eve!,0
I was over charged TWICE in one day! still waiting for a respond ! This was a month ago.. Very disappointed thought I found a good service....Aracelis407-237-0562,0
7/29/2018 Have you as a driver tried to get app support when urgently needed.....forget it!!!! At least lyft has phone support that can be accessed within minutes.,0
"These bastards wasted so much of my time. Declined me for joining up, then told me to go get the driver accreditation. After getting it they still declined. Kuunts",0
Took uber to club $22 took uber back home from same place 8.9 miles $115.00. How can they get away with this? They should be ashamed of themselves! Spread the word,0
"24 charges to my card by Uber technologies, none of them on my Uber account, no ""ghost rides"", but $1,200 of bogus charges to Uber. USAA notified me, cancelled card.",0
"Never could get a confirmation. My G.P.S. was floating. They said my phone was not valid. In Chicago, it's not worth the delay. NEVER again, this has been disgusting.",0
UBER treats their drivers with disrespect and essentially scams drivers into investing more time and money than the company pays. Much better driving companies out there,0
Whys it so hard to find Darlington road.se27 0ud my satnav brings me to door .cab always on wrong road so I have to walk around roads looking for cab . On going problem.,0
You can close this business and search for better one. Free Ride concept is also fraud...... You cannot stand in good possession. We all IT peoples are hate UBER.............,0
I have never used UBER and never will after reading reviews and stories on the news. If enough people stop using them they will be forced to fix the problem or go out of business.,0
Get $50 in ride credits from Lyft for those that need to get to voting stations in any city. No excuse not to be able to get to voting stations. https://www.lyft.com/invited/1WORLD,0
I am currently uber driver. You never believe I drove to BWA for $35 without gas and mileage and tax expenses. It is to customers but not for drivers unless to those they do not math.,0
"it is unfair ilegal ,unsafe for 100 percent ,annoying inefficent stupid customer service staff in toronto. these are people who are purchasing laws to operate.must be regulated legally.",0
Uber is not good for the country because they are taking off the marker traditional taxis which we need in the London. We are better off without uber and use our black taxis like we use.,0
"While sitting at home in North Carolina, I received two Uber receipts for taxi rides in New York. The larger 998.13. Now the support site is unavailable. I have canceled the credit card.",0
Uber went from 5% commission - 25% and now they have raised the safety fee to $1 60 per ride. So all in all if you done about $100 worth of work with Uber you are looking at about 60 bucks.,0
I have travelled with ola cabs was never cheated like this the driver made us pay the airport fee by cash 110 when it was alredy included in the.the bill was 286+110=396.when we paid 506=396+110,0
The customer service will drive you to insanity. Ive been attempting to get assistance now for 12 HOURS since their uberpool option isnt showing up on my viewer and the help system is automated.,0
Trabajar como chofer de uber Es el tipo de exploration mas horrible que se a credo en la ultima decada ya que no cumplen con sus predicaciones donde recomendan que se unan a ellos como trabajadores,0
Uber cabs is a company that provides service and that is the what they are very very bad at. Their customer service and their efforts towards resolving any grievances of its customers amounts to nothing.,0
Try to contact anybody on Uber either by phone or the internet. These idiots that run Uber do not realize that they can also go under. Nobody is too big to fail. I can do without Uber. They can go to hell.,0
"The app does not work correctly. After 4 tries I was able to enter my from address and destination. When I tried to order a car I kept getting error messages ""Uber failed"". Finally drove myself. Never again.",0
"I used this once in America, I was advised to get the app which I did. 10 months later they have taken nearky £300 out my bank account.!!!. I'm. In touch with the fraud team now it's stress I can do without...",0
"Liars, cheats and thieves. They treat employees so badly and constantly make mistakes with payments. Not surprisingly, the mistakes are ALWAYS in Uber's favor. Did I mention they are liars, cheats and thieves.",0
"I started driving for uber. They take so much out of my far. I figured it out that after gas, I make less then minimum wage, and none of this includes wear and tear on my truck .I would not recommend it at all.",0
I have been charged multiple times now for rides I have not taken. And every time I try to resolve the issue I'm never able to get a hold of anybody and nobody contacts me back. It is more of a scam then a service,0
I reported someone who stole my debit card and stole over $200.00 from my account. They did absolutely nothing. Someone told me via email someone has to pay for them to get around. I couldn't even speak to anyone.,0
"Used Uber Eats 1 time in Atlanta GA, now my card has been used for other transactions to Uber. No way to let Uber know the possibility of their drivers selling credit information. Will never use this service again!",0
It pays lowest wages $14/hr plus you will be using your own car. Their customer service is sh**.what do you expect from customer service people when company ceo is sh**.reffering to ceo video went viral on youtube.,0
"uber sucks. They suspended me, someone who has spent over 1000s in their company because I did not like their rude customer service. They also automatically send you to a higher uber car, if uberx is not available.",0
"$579 for an SUV to take us 20 minutes down the road. Find alternate transportation! Not to mention their customer service is the worst customer service I have seen in a ""customer service based"" company! WHAT A JOKE!",0
My rating keeps going down every time I ride. I am a pleasant customer. Either uber app is messed up or something else. Why no promotion's or discounts? I have been using it for past 2 years and no discounts. HuH! avoid.,0
I was charged a 4.7 times surcharge Now i'm trying to resolve this with Uber customer service and what a joke It's like being trapped in an endless circle. I will not use them again and I will not recommend Uber to anyone,0
two days after using uber for transportation I checked my bank account and noticed seven un authorized fraudulent activities on my account. Be careful with giving out you financial information when setting up your account.,0
Most unreliable service you will ever find. I was left waiting for a car for over an hour even though it showed the driver only being a few minutes away. Terrible service. Do not use uber. I would rate them zero if I could.,0
I scheduled my ride 3 days ago for Friday night to go to an event that cost me $450. The ride never showed so I scheduled another ride. Confirmed it and another no show. I ended up driving myself and being late. Inexcusable.,0
I use UBER frequently but this last time I was accused by a White driver that her property was stolen from her car. UBER contacted me to tell me my account had been canceled. I tried to contact UBER but they never replied back.,0
