text,label
"Where do I even begin? I ordered my food at 9:15pm. My delivery time kept increasing, and increasing. Finally at 10:30 I called the restaurant. One of their employees answered and as soon as I said we were the grubhub order he knew exactly who we were. Our food was ready for pickup at 9:22. The driver never showed up. At 10:40, that same employee who is NOT affiliated with grubhub got in his car, on his own time, with his own gas money to bring us our food because he felt bad that we had waited so long. I began a customer care live chat immediately following, asking for a refund because grubhub literally did nothing to deserve our money. The restaurant was amazing, and ordering from grubhub made our experience horrendous, we didn't get our food in a timely manner, grubhub played no part in the delivery of the food, and now it is past 11:00 at night and we're finally about to have dinner. This has been horrible. The customer care person refused to refund us, which leads me to my next point of major irritation. We will have to file a credit card claim because grubhub can't even do the right thing and refund loyal customers. I will never use grubhub again and urge anyone who reads this to steer clear. Even the restaurant wants to be done with grubhub, and they will be vouching for me to my credit card company when I file my claim against grubhub.",1
"Awful experience! Order food at 7:05pm. Said estimated was 7:55pm -8:05pm. Nothing changed on my tracker called the restaurant at 8:15pm. The restaurant informed me my food was done awhile ago and simply no one picked it up. Then I called GrubHub customer service. She informed for what ever reason my driver left and I had no driver. And she just put another driver on route to pick up my food. I asked if there was anything she could do. She said she could give me a 10off for my next purchase. I asked if I could have it on this purchase I made now. She kept repeating ""we can give you a code for your next purchase"" I informed her that I rather have it on this purchase since I probably will not use GrubHub again. (Rather just pick up my food when it's warm then get cold food). She then said she could refund the tip I charged to my card. I said no to that.(why would I not tip, since it was a new driver) 10 mins go bye and guess what ?! I still didn't get a new driver. I did get a refund on the plus.  To sum it up I had to contact them to ask why my food wasn't delivered, but the restaurant made my food awhile ago. The said it's because I didn't have a driver.. makes me wonder if I didn't call would I haven't received my food or would I receive it 3 hours later or more ? Don't use GrubHub, your better off picking up your food yourself or using anything else but GrubHub. Unless you want cold food, possibly no driver delivering your food,BUT don't worry you 10 off your next purchase, because the first time experience wasn't bad enough",1
"I don't usually voice my opinion about things but they have gone too far and done nothing to help. I mean I guess I could thank them for the exercise I got from the run around they gave me. This is what I wrote to them and of course got no $#*!ing response. Hello, On Sept 2, 2017 i placed an order through grub hub to luna grill order #1617001691 totaling $25.16 on a card and was told it had been cancelled. I called the number attached to the email and was told that my order was cancelled due to the fact that the delivery driver had been in a minor car accident, so i placed another order elsewhere for more food. I was then delivered my original order from luna grill  after I was told it had been cancelled. I just wanted to make sure that I was not charged the $25.16 from luna grill, because I would. Ever have places a second order for food if i had not been told my original order had been cancelled. I hope this matter gets resolved in a timely manner.  I heard nothing in return and called back after the 3-5 business days. So I waited a little longer. Anyway, finally on my 4th attempt I was told that there was nothing that they could do and to go ahead and file fraudulent charges with my bank. What the actual $#*!?! So they charged me for food I never received and then did nothing but turn a blind eye. Pinchi tontos ($#*!ing idiots) I would have never placed a second order if it wasn't for them canceling my first one. But don't let my experience ruin it for u. Just make sure u really want that food before you place an order. I will never again, I'd rather get up with the worst cold and fever and drive to get whatever I need. $#*!ing grub hub!",1
"This was by far the worst experience I have ever had with any company. My coworkers and I ordered for lunch, which was to be delivered at 10:50. 11:10 came around and we called Grub Hub to find out what was going on with our order as we only get 30 minutes for lunch. The woman on the line was very rude and unconcerned. We informed her that our order said it was delivered and the delivery driver was nowhere to be found. After waiting on hold for 10+ minutes she got in touch with her driver and stated he could not find the office and had returned the food. How is it that it was delivered as the website said, when in reality they had taken it upon themselves to return it without calling or contacting us in any way. We noted specific directions on the notes on our order and also asked that the delivery driver contact us when he arrived. None of which happened. The lady offered for him to bring the food back, however refused to give any sort of refund or discount and this went on for over an hour, so the fries/burger/etc would have been cold by the time this happened. She refused to help and when asked for her manager she placed us on hold for 30+ minutes before we finally hung up and called back. The following representative was asked if she would be able to handle the situation or if we should speak to the manager as we did not want to repeat ourselves a 3rd time. She stated she could and then like the other rep was unable to do anything for us. The best the manager was able to do was give a refund and not ever deliver our food. So we all missed our lunches and as we work 10 hour days this is unacceptable. The drivers excuse was that he could ""not find us and was confused"" even though clear instructions were written on the order. I think it is unacceptable that no one attempted to contact us that the food was returned and that he marked delivered which is a blatant lie. We will NEVER use this service again in the future. I do not recommend Grub Hub to anyone.",1
"This is the first time ever I've used GrubHub, and I'll be damned if it is not the last time, as well.  Typically I just find local restaurants with a delivery option, but since I was craving some gyros and there weren't any delivery choices nearby, I decide to go with GrubHub.  I would've never made that mistake if I wasn't very hungry.  At first it seemed  all cool- the order was placed, there was a spot for any special instructions, and I got a cute confirmation text right away.  The only thing that bugged me right away was a mandatory tip (I prefer to give out cash tips), but whatever.  So far, so good.  Then the trouble started.  Estimated delivery time was about 1 hour from order time, then as the delivery time approached, it was delayed for another hour!  Meanwhile, the online ""tracking status""  showed that the food wasn't prepared yet, which is really weird for gyros. At this point I called the restaurant to see what's going on, and they told me the food was prepared a while ago, but the driver hasn't showed up yet, and asked me if I want to cancel the order since the food would definitely get cold upon delivery.  I decided to keep it since I was still very hungry.  Then I called GrubHub, twice.  The first time a lady who couldn't care less replied that ""there's nothing they can do about it, and no refund can be given whatsoever"".  I hung up and called back again.  This time, a guy who seemed to be frustrated with the entire company he was working for, said that the best they could do is give us a GrubHub discount/credit.  That wasn't much of a solace, since at this point I was determined not to use them ever again, but at least he tried.  Finally, after another cheerful update notifying me that the food is on the way, I received a phone call from the driver saying he was downstairs.  By the time I got it, the food definitely was cold; also, the ""special instructions"" note was mysteriously ignored-  I asked for no pita, but it was still included, and the sauce wasn't on the side as requested.  Of course it could've been the cooks who messed up the order, but judging from all the other reviews, it must be GrubHub that didn't forward the order properly.  So yeah, unfortunately what sounded like a great idea in theory (delivering food from restaurants that don't have their own delivery service to hungry customers) turned out to be a disaster in real life.  Stay away unless you enjoy delayed, overpriced, cold food and crappy customer service!  P.S. I'm surprised nobody got sued yet for food poisoning because of severely delayed food.",1
"I've tried it twice so far, and it failed to make it to the door both times, even though I paid for it.",0
Don't use this service. They're customer sets is bad and do not know what they are doing! Use uber eats,0
"They never delivered by food... Also, I'm a diabetic, so that didn't help. Will never use this app ever again",0
GrubHub delivery from Alibaba took two hours and the food was soggy and cold.  The poor ratings are well-deserved.,0
They have one restraint near me It's sucks  Llllllokjjjhbffvvvccc.   Cccfyhnvvvvvvvbggghhyyyytgvggggghhbbbbbvvggggv,0
Wouldnt refund or redeliver. They suck. Over it. Use another vendor!!! Waste of money and time. Thanks for nothing.,0
"If you goto order food, they will show you pictures of one thing, put something else on your order and refuse to fix it.",0
This is expensive and a worthless service. They came to my house with cold food 2.5 HOURS AFTER I ordered.  Never again!,0
Horrible ... Ordered from 2 places ... The first didn't get it and the second doesn't deliver past the time I ordered....,0
Order was canceled 40 minutes after it was suppose to be done. Then said they tried to call but no one answered. BULL$#*!!,0
Id rather give ZERO STARS! NEVER ORDER THRU THEM THEY HAVE THE WORST CUSTOMER SERVICE IN THE ENTIRE WORLD!! I MEAN THE WORST!!!,0
I ordered my food 2 hours ago and I still haven't received my food. Even worse than that Customer Service won't answer my calls.,0
Terrible service. Food is never on time and always cold. And when you call to complain they dont care and dont do anything to help.,0
$35 pizza arrived 1/2 hr. late and cold.  This is my first and last order from Grub Hub.  My $35 pizza arrived 1/2 hr. late and cold!!!,0
"I can not tell you how many problems I have had with them, I will not go into all the problems it would take forever. Use another service.",0
"My order wasnt delivered but cancelled after one hour. I was so hungry. They had made me wait an hour, to tell me they cancelled the order.",0
Grubhub is the worst app ever !! The prices always change and coustmer service sucks ! Please bring back order up ! Do not order from grub hub,0
"I ordered food only to be told and hour later there were no drivers in my area to deliver what I ordered. Oh, after I've was already charged of course.",0
Ordered twice no food both times after waiting 2 hours for each order.They tell you your order is on the way then hours later tell you it's not coming.,0
Bad customer service only refunded food to reorder what they messed up on. More delivery feed and tip and tax just to get the correct items. Never again!!!!,0
Order delivery estimate was 45-55 minutes. Right!!! Try two frigging hours. I can say I tried this service twice... my first and last at the same time. FAIL,0
had issue with my order called customer service very  rude non speaking agents the agent hang up on me called 2nd time the guy was very rude and also hung up,0
"In my wildest dreams, I could not imagine a worse company or crappier customer service.  Don't waste your time or Money. I could go on and on.. Just STAY AWAY.",0
Delivered 1 of 2 meals.  Customer service obviously outsourced overseas.  30 minutes to get a refund of the missing items and tip.  No refund on delivery charge.,0
"The worst experience ordering, customer service. This is what I paid for. This is a scam business. Really hoping gradhub go out of business. They should not exist.",0
crown friend chicken in hicksville $#*!ing sent a boc of chicken and fries with a dead roach in it and grub hub said they cant help with refund.... $#*! all you $#*!s,0
"I don't use grub hub because back when it was delivered dish I'd always get the wrong order. I used is yesterday because I was sick, and of course wrong order once again!",0
"This place Sucks! I left a million Texted messages about my gate code and everything els, was the biggest WASTE OF MY TIME 8:12 TO 10:30 and called 3 times that was BS...",0
PAid 50$ for pizza. waited 5 hours and it never showed up. grub hub told me they would not give me a refund because i was not willing to wait for the food to be delivered!,0
Food never showed.  Called customer service 21 min ago to reach a resolution; still haven't spoken with anyone just listening to some awful piano music.  This is bull$#*!.,0
"We ordered at 10:16, 12:30 food never came.   Refused to offer refund and said they would assign a new drive to bring me my 2 hour old food. Will never EVER use them again.",0
"Doesn't even deserve one star! Two hours I waited only for them to text me the notification that they cancelled my order. DONT WASTE YOUR TIME, use Doordash or postmates app.",0
Second time that happens in the same month. First time I didnt even get a refund. The second time after two and half hours of haggling I finally got me a refund. In theory...,0
according to the website it was actually going to take 3 hours. The restaurant is 3 miles away and closes before I would have gotten my food. I will NEVER use grub hub again.,0
"This is the worst way to get food, Im finding out the hard way. 2 hours since my food was promised and still nothing. The restaurant did their part and now the food is wasted.",0
"Worst company ever. Took my order, made me wait for 3 hours and then cancel it without notice, no reason. No one could give me an answer. Anyway, first and last time using it.",0
Wish I had read the reviews before they took my credit card and other info and charged me for an order that they claim I never made. Liars and thieves Id rate minus 10 if I could,0
"I ordered from Grubhub and the restaurant cancelled the order.  Yet, the credit card was still charged and every time I tried to contact them to get it revised I was ignored.  Scam",0
"used grub hub twice. both times the order was delivered over 45 minutes late, after my lunch was over. food was cold and gross. ended up throwing it all away. Do not waste your time...",0
Grub Hub is unreliable. This is just one particular bad experience of many. I ordered food 3 hours ago and it shows delivered but i have no food. the restraunt is one mile from my house.,0
"I order lrge catfish dinner. The food was warm. I didn't receive any hot sauce or  mild sauce,bread or,.napkins, Will not order from them again. Sharks fish and chicken on Madison in cggo.",0
They got my order wrong was ice cold when it got to me I would never use this app again and for the money I spent I should be able to enjoy my food but nothing good about this food app.....,0
Placed an order in the afternoon for a dinner delivery from KFC. Ten minutes before it was expected we got an email stating that the order was cancled and to expect our refund in a few days!,0
Grubhub have recently been having trouble with payments: unprocessable.  I called customer service and they said use another card.  I contacted my bank and there is nothing wrong with my card.,0
Great idea but works terribly. Probably nothing against the company but it takes an hour and a half and is always cold and costs $25 for a cheap meal. Just not worth it unless you are starving.,0
never got our food.  Time of delivery kept extending.... the excuse.... no drivers...wtf people... you are a delivery service with no drivers!?!? Don't have drivers then don't take orders morons!,0
"going on 2 hours and 13 minutes and still waiting. The place is less than 2 miles away, does it take grubhub an hour a mile? worst service ever. first and last time I ever use grubhub never again.",0
This is a ridiculously long amount of time to wait for food...restaurants were closing as I was still waiting and didn't have any other arrangements for food that night.  It's a terrible experience.,0
Bad customer service it takes about a hour and a half to get your food just for the order to be wrong missing items no one is held accountable and grub hub still has not refunded me my money Grub hub is,0
Food never arrives on time. Frequently have to wait 30-60minutes extra for food to arrive. Only worth using if you are dead set on ordering from a restaurant that only offers free delivery through Grub Hub.,0
"Do not use this service! They are a ripoff and do not care about the customer. They grab your money and go, that's what they're good at. Do not deliver, will not refund and lies to you. DO NOT USE EVER!!!!!!",0
On 4 separate occasions Grubhub has canceled my order without  notification. The they have the audacity to try and compensate me with$5! Its always an issue with them. I will not be using Grubhunb ever again.,0
"They canceled my order after 2 hours.. I swear if there were zero star, I would give it to them. Why making me wait then say  oh sorry we dont know what happened And their customer service take forever to answer",0
"If you like your food to sit at the restraunt only to never be picked up, then grubhub is for you. I ordered some Mongolian grill but I got Ethepoian food, aka, nothing. They can eat a flaming bag of babboon $#*!s.",0
"You mother$#*!ers need to be shut downnn!!!! My promo code never works, even as a new user. If your intentions is to make me paying for food more than what I originally do then I don't need your $#*!KIING HELP!!!!!",0
"Food arrived an hour late and very cold. I paid $33 for the order, and they gave me a coupon for $7. Their CS agent logged out of the chat before checking if I was done talking. Super rude. They just lost a client.",0
"I waited over 2.5 hours and still did not receive my food, finally called and canceled the order. This was not a fluke, since it happened 3 times in a row within a few weeks. This company will go belly-up very soon.",0
"I ordered food from their site, the restaurant didn't have what I ordered, they waited 30 minutes to call me to tell me they didn't have what I ordered. so they cancelled my order after 30 MINUTES ARE YOU KIDDING ME",0
I have tried Grub Hub and not happy at all.  Either restaurant is no longer affiliated but is on the site. Takes your money and then cancels.  Next try waiting 2 hours for delivery.  Unacceptable.  Will not use again.,0
Customer service refused to refund a delivery fee for food I did not recieve and refused to send a driver to deliver the food I paid for but never received.. So I lost money on on an order in which I did nothing wrong.,0
I have ordered from them three times now. First time- the restaurant didnt get the order and the last order half my order wasnt delivered. They forgot items out of my meals. The price is to high for this lousy service.,0
"Absolute garbage customer service. Was threatened, and got many copy and paste texts when I had a question about something. They also tried to cut me off many times short and kept repeating the same thing over and over.",0
"When I placed the order it said 30 minutes.  Then it changed to over an hour. It's only 4 miles from where I am, but I'm in a semi and can't go just anywhere.  And I'm on a schedule.  I don't recommend this service at all.",0
GrubHub and its competitors are way too expensive and frankly not worth it . I go with beyond menu they charge $1 delivery fee and then I tip the driver the only problem is they don't have a whole lot of restaurants just yet.,0
Tried to use grub hub 3x in the last month and EVERY SINGLE TIME the orders keep getting pushed back over and over and over and over again. If you don't mind waiting almost two hours for cold food go ahead and waste your money.,0
Ordered my first and last meal with GrubHub today.  Didn't get my food but I was charged and they refuse to refund me.  Basically what everyone else is saying.   Please take our advice and stick to UberEats or regular delivery.,0
I used their service until they spoke out with political partisanship. Never again. There are other services like Skip the Dishes that provide the same thing and don't succumb to politics. Look it up and make your own judgment.,0
"Food that never arrives, customer service that runs you in circles without ever addressing your problems, and the best they are willing to offer in compensation is an apology. If I could give zero stars you can bet that I would.",0
"Don't use it. Even restaurants owner.They turn your restaurant off whenever they want. Their only answers are just ""I don't know "" OR "" not enough delivery guys""  If you like the food from other restaurants directly call to them.",0
Their customer service is beyond ridiculous. I waited over two hours to be told that no one was dispatched. They offered me 10 whole dollars fire my $40 order that ended up being cancelled. Will never do business with them again.,0
"Order was supposed to be delivered by 10:30 ended up getting my food at 11:30.. An hour later. Food was cold: Wings, fries and chicken tenders from Buffalo Wild wings. Dinner sucked and I paid $75 for it. NEVER will I use grub hub again.",0
"It doesn't matter whether the restaurant is at fault on your order, they do nothing to compensate you all; they have a $10 min on orders, before tax, so if a part of your order is screwed and it costs less than that, don't expect to eat.",0
"restaurant directly, I got a really nasty guy who said that he called me when he did not.  I went online to try to get grubhub involved and they were completely useless. The food arrived late and cold and grubhub was not concerned at all.",0
Stay away from grub hub if you order through them and the restaurant cancels the order they claim they will refund your money but they won't I still have not received my money for my order they still owe me so beware of this crooked company,0
"After taking $40 for $16 worth of burritos they simply never showed up despite a confirmation of recept on their stupid website tracker. Can't offer a refund until they talk to the store, which can't happen until next week. Thaaaanks, Grubhub",0
"I called after two orders were canceled and guess what, GrubHub offered me a five dollar credit and the guy on the phone sounded like a robot like he didn't care at all and that it was something so common for them that they're just used to it.",0
"They make false claims of offers, sending emails and push notifications and then will not honor them at checkout. They have done this multiple times and it demonstrates unethical advertising practices, including but not limited to bait & switch.",0
It is horrible i want to buy one thing for nine dollars and i have to spend 18 or more just to proceed to checkout i cant even get a sandwich for 9 dollars you are forced to pay a minimum balance of 18 if you go below you cant proceed to checkout,0
"After waiting an hour for my food delivery, the company sent me a text telling me that my order was cancelled. I called their customer service and they stated they didn't have anyone to deliver the food in my area. LOL What a bunch of idiots......",0
"Have used grubhub twice, over both orders we have been shorted over 50 dollars worth of food, the second time we ordered the food was completely mixed up, half of what i wanted in half of what my wife wanted. Feel like i have been robbed... twice.",0
"Placed an order, waiting over an hour for delivery.  Called the restaurant to see if it had been picked up and was told it had been canceled 45 minutes earlier.  I didn't cancel it, Grub Hub did without any notification.  I know not to use them now.",0
Waited an hour despite being quoted 35-45 minutes. Called. Was told I would be compensated and order would arrive within half an hour. It never did. Got a text 15 mins later to inform me my order was cancelled. Restaurants now closed. They're awful.,0
"Ordered taco bell, $#*! was a hour late. After I called for a refund I called my bank card and they took out more money than what they were supposed to. Tf I will never order from punk ass slow ass grub hub again . And I would not reccommend to anybody",0
I wish I had read these before I ordered - they are disgusting. If you order from Grubhub - be sure you understand you may or may not get your order - they are clueless. I also wouldn't trust that the food is fresh - will never order through them again.,0
I will never use GrubHub again.  Twice already they pushed my order delivery time 1.5 hours past the original delivery time.  Called customer service was on hold for over 20 minutes.  I don't understand how a company survivors with this awful of service!!!,0
"Site doesn't work, login doesn't work, tried every login option. First and last time I'll attempt to order thru grubhub. Oh and ""connect with us"" doesn't have any contact info. Waste of time. I am tech savvy and this site just does not work. Look elsewhere.",0
